{
  "schema_version": 1,
  "reference": {
    "project": "ruptures",
    "commit": "ee1c8ff8a548d54c641b2bb471562165931f31c7",
    "python": "3.11.14",
    "platform": "win32"
  },
  "signal": {
    "shape": [5, 2],
    "dtype": "float64",
    "values": [1.0, 10.0, 2.0, 8.0, 5.0, 7.0, 9.0, 3.0, 10.0, 2.0]
  },
  "parameters": {
    "cost": "CostL2"
  },
  "breakpoints": [2, 5],
  "segment_cost": 30.5,
  "objective": 30.5,
  "expected_difference": null
}
